{
  "$id": "lena_video_learning_v1.schema.json", "$schema": "https://json-schema.org/draft/2020-12/schema", "type": "object", "additionalProperties": false,
  "required": ["schema_version", "artifact_type", "artifact_id", "property_id", "video_id", "governed_date", "created_at", "generator_version", "upstream_artifacts", "hook", "framing", "action_type", "wardrobe", "environment", "camera_grammar", "voice_use", "metrics", "allowed_learning_conclusions", "confidence_basis_points", "prohibited_overfitting"],
  "properties": {
    "schema_version": {"const": "lena_video_artifact_v1"}, "artifact_type": {"const": "lena_video_learning_v1"}, "artifact_id": {"$ref": "common_defs_v1.schema.json#/$defs/artifact_id"}, "property_id": {"const": "lena"}, "video_id": {"$ref": "common_defs_v1.schema.json#/$defs/video_id"}, "governed_date": {"$ref": "common_defs_v1.schema.json#/$defs/governed_date"}, "created_at": {"$ref": "common_defs_v1.schema.json#/$defs/created_at"}, "generator_version": {"$ref": "common_defs_v1.schema.json#/$defs/slug"}, "upstream_artifacts": {"$ref": "common_defs_v1.schema.json#/$defs/upstream_artifacts"},
    "hook": {"$ref": "common_defs_v1.schema.json#/$defs/nonempty_string"}, "framing": {"$ref": "common_defs_v1.schema.json#/$defs/nonempty_string"}, "action_type": {"$ref": "common_defs_v1.schema.json#/$defs/slug"}, "wardrobe": {"$ref": "common_defs_v1.schema.json#/$defs/nonempty_string"}, "environment": {"$ref": "common_defs_v1.schema.json#/$defs/nonempty_string"}, "camera_grammar": {"$ref": "common_defs_v1.schema.json#/$defs/nonempty_string"}, "voice_use": {"enum": ["none", "lena_voice"]}, "metrics": {"type": "object", "additionalProperties": false, "required": ["retention_basis_points", "completion_basis_points", "rewatches", "shares", "saves", "comments", "follows", "clicks", "revenue_cents"], "properties": {"retention_basis_points": {"type": ["integer", "null"], "minimum": 0, "maximum": 10000}, "completion_basis_points": {"type": ["integer", "null"], "minimum": 0, "maximum": 10000}, "rewatches": {"type": ["integer", "null"], "minimum": 0}, "shares": {"type": ["integer", "null"], "minimum": 0}, "saves": {"type": ["integer", "null"], "minimum": 0}, "comments": {"type": ["integer", "null"], "minimum": 0}, "follows": {"type": ["integer", "null"], "minimum": 0}, "clicks": {"type": ["integer", "null"], "minimum": 0}, "revenue_cents": {"type": ["integer", "null"], "minimum": 0}}}, "allowed_learning_conclusions": {"$ref": "common_defs_v1.schema.json#/$defs/optional_string_list"}, "confidence_basis_points": {"type": "integer", "minimum": 0, "maximum": 10000}, "prohibited_overfitting": {"$ref": "common_defs_v1.schema.json#/$defs/string_list"}
  }
}
