{
  "schema_version": "lena_video_artifact_v1",
  "artifact_type": "lena_video_learning_v1",
  "artifact_id": "lena_video_2026_08_03_spacex_launch_001_learning_v1",
  "property_id": "lena",
  "video_id": "lena_video_2026-08-03_spacex_launch_001",
  "governed_date": "2026-08-03",
  "created_at": "2026-08-02T22:35:00Z",
  "generator_version": "lena_video_learning_author_v1",
  "upstream_artifacts": [
    {
      "artifact_id": "lena_video_2026_08_03_spacex_launch_001_manifest_v1",
      "sha256": "f06167f585b34b5263a1506ab7decfb193931e1a7ea40b4639a5533c01eae946"
    },
    {
      "artifact_id": "lena_video_2026_08_03_spacex_launch_001_qa_v1",
      "sha256": "dd7b5a0c15a17dd8a2f3875010798368ccfbbb79f7f9b6cb2467dd6379c48133"
    }
  ],
  "hook": "Contained breath and immediate rocket emergence create a human-first launch hook before the performance expands into delight and awe.",
  "framing": "Companion-held vertical three-quarter smartphone framing with twelve-percent headroom and the distant launch corridor over Lena's shoulder.",
  "action_type": "reaction_with_completed_point",
  "wardrobe": "Fully fastened small jean shorts, fitted long-sleeve surfing rash guard, and low-profile shoes with full-shot continuity.",
  "environment": "Lawful public coastal viewing lawn with boardwalk, rail, water, spectators, morning light, atmospheric haze, and distant rocket geometry.",
  "camera_grammar": "Another person uses a rear smartphone camera with stable two-handed micro-reframing, face-priority focus, and no selfie behavior.",
  "voice_use": "none",
  "metrics": {
    "retention_basis_points": null,
    "completion_basis_points": null,
    "rewatches": null,
    "shares": null,
    "saves": null,
    "comments": null,
    "follows": null,
    "clicks": null,
    "revenue_cents": null
  },
  "allowed_learning_conclusions": [],
  "confidence_basis_points": 0,
  "prohibited_overfitting": [
    "draw no performance conclusion before a final quality-approved output exists",
    "draw no audience conclusion without governed impressions, retention, and completion denominators",
    "do not attribute outcomes to wardrobe, environment, hook, HPE, camera, audio, or voice from one episode",
    "do not infer revenue or commercial value from views, comments, or anecdotal reactions alone",
    "do not change identity, safety, disclosure, cadence, spend, or authorization policy from learning data"
  ]
}
